[
    {
        "id": "7-zip",
        "name": "7-Zip",
        "publisher": "Igor Pavlov",
        "category": "system-tools",
        "platforms": [
            "linux",
            "mac",
            "windows"
        ],
        "official_site": "https://www.7-zip.org",
        "official_domain": "7-zip.org",
        "download_page": "https://www.7-zip.org/download.html",
        "source_repo": "https://github.com/ip7z/7zip",
        "winget_id": "7zip.7zip",
        "version": "26.03",
        "released": "2026-09-03",
        "license": "GNU LGPL (parts BSD-3-Clause; unRAR restriction)",
        "files": [
            {
                "filename": "7z2603-x64.exe",
                "build": "Windows x64 installer",
                "size_mb": 1.6,
                "sha256": "0859c524b8a63551848f0c246abddcb1d0b7b656b0fbfe879f8d85e61a9e6edd"
            },
            {
                "filename": "7z2603.exe",
                "build": "Windows x86 (32-bit) installer",
                "size_mb": 1.3,
                "sha256": "0f6ec2eda1f8c5dc4c267ee761c0dad8a9d5e8863e0c84b7ac026bc9625a1560"
            },
            {
                "filename": "7z2603-arm64.exe",
                "build": "Windows ARM64 installer",
                "size_mb": 1.5,
                "sha256": "e22ce71c11dcf503c448fe51e56f41830eb4e1344fa5c7731ae63bce533a8e8e"
            },
            {
                "filename": "7z2603-x64.msi",
                "build": "Windows x64 MSI",
                "size_mb": 1.9,
                "sha256": "c0680064d698a62dd4a5a47f403db356a6531a5473e4c4b1d090ea2590513926"
            },
            {
                "filename": "7z2603-linux-x64.tar.xz",
                "build": "Linux x64 console version (7zz)",
                "size_mb": 1.5,
                "sha256": "dc99eff5008f1ab79bd7084c68513701547a808a89502bf4133683535ab3c695"
            },
            {
                "filename": "7z2603-mac.tar.xz",
                "build": "macOS console version (7zz)",
                "size_mb": 1.8,
                "sha256": "5ca87677072c59f5602e5c49baa27d4694bacd2259b4e507f0094249d4281480"
            }
        ],
        "known_impostors": [
            {
                "domain": "7zip.com",
                "source": "https://sourceforge.net/p/sevenzip/support-requests/559/"
            }
        ],
        "checked": "2026-09-25",
        "details_url": "https://softwares-academy.com/software/7-zip/"
    },
    {
        "id": "aimp",
        "name": "AIMP",
        "publisher": "Artem Izmaylov",
        "category": "media-players",
        "platforms": [
            "android",
            "linux",
            "windows"
        ],
        "official_site": "https://www.aimp.ru",
        "official_domain": "aimp.ru",
        "download_page": "https://www.aimp.ru/?do=download&os=windows",
        "winget_id": "AIMP.AIMP",
        "version": "5.40.2727",
        "released": "2026-09-08",
        "license": "Freeware",
        "checked": "2026-09-26",
        "details_url": "https://softwares-academy.com/software/aimp/"
    },
    {
        "id": "apex-legends",
        "name": "Apex Legends",
        "publisher": "Respawn (published by Electronic Arts)",
        "category": "games",
        "platforms": [
            "windows"
        ],
        "official_site": "https://www.ea.com/games/apex-legends/apex-legends",
        "official_domain": "ea.com",
        "download_page": "https://store.steampowered.com/app/1172470/",
        "license": "Free to play",
        "checked": "2026-09-26",
        "details_url": "https://softwares-academy.com/software/apex-legends/"
    },
    {
        "id": "apple-music",
        "name": "Apple Music",
        "publisher": "Apple Inc.",
        "category": "media-players",
        "platforms": [
            "android",
            "iphone",
            "mac",
            "windows"
        ],
        "official_site": "https://www.apple.com/apple-music/",
        "official_domain": "apple.com",
        "download_page": "https://apps.apple.com/app/id1108187390",
        "license": "Proprietary",
        "checked": "2026-09-26",
        "details_url": "https://softwares-academy.com/software/apple-music/"
    },
    {
        "id": "audacity",
        "name": "Audacity",
        "publisher": "Audacity Team (Muse Group & contributors)",
        "category": "media-players",
        "platforms": [
            "linux",
            "mac",
            "windows"
        ],
        "official_site": "https://www.audacityteam.org",
        "official_domain": "audacityteam.org",
        "download_page": "https://www.audacityteam.org/download/windows/",
        "source_repo": "https://github.com/audacity/audacity",
        "winget_id": "Audacity.Audacity",
        "version": "4.0.1",
        "released": "2026-09-30",
        "license": "GPL-3.0",
        "files": [
            {
                "filename": "audacity-win-4.0.1-x86_64.msi",
                "build": "Windows x64 MSI",
                "size_mb": 47.49,
                "sha256": "efb652bf04168f5d4893f28b7cefaaf5ef385d9251544540ac774e3bf54793a3"
            },
            {
                "filename": "audacity-win-4.0.1-arm64.msi",
                "build": "Windows ARM64 MSI (Windows 11 only)",
                "size_mb": 36.49,
                "sha256": "b6606d9bcb1a49254f1966c7edc68d78f7eadd04eebe7d4676350f32ca675f49"
            },
            {
                "filename": "audacity-macOS-4.0.1-universal.dmg",
                "build": "macOS Universal",
                "size_mb": 87.74,
                "sha256": "473db7ce0d846d2d45df97e8e83ff4c70fc835eff6bcc9e119d8eac34f979794"
            },
            {
                "filename": "audacity-macOS-4.0.1-arm64.dmg",
                "build": "macOS Apple Silicon",
                "size_mb": 47.72,
                "sha256": "278c8647b78c77af7f07dbd5e7d9bfc950bc14168047b65738716b61d12055ec"
            },
            {
                "filename": "audacity-macOS-4.0.1-x86_64.dmg",
                "build": "macOS Intel",
                "size_mb": 51.81,
                "sha256": "9794b0b3a3a795bdc097b411a5776ba59dc451cb1524f58c9714c30cca2564be"
            },
            {
                "filename": "audacity-linux-4.0.1-x86_64.AppImage",
                "build": "Linux x86_64 AppImage",
                "size_mb": 70.34,
                "sha256": "ca2f04f172124d1f18ac608749854c5d31f04ab266a758c348190c05d9b2087c"
            },
            {
                "filename": "audacity-linux-4.0.1-aarch64.AppImage",
                "build": "Linux ARM64 AppImage",
                "size_mb": 67.39,
                "sha256": "3abc517f26f00197eaac9c4e56b35dc53d8e933764b41077950e8526cd4aa075"
            }
        ],
        "checked": "2026-09-30",
        "details_url": "https://softwares-academy.com/software/audacity/"
    },
    {
        "id": "avidemux",
        "name": "Avidemux",
        "publisher": "Mean (Avidemux project)",
        "category": "video-editing",
        "platforms": [
            "linux",
            "mac",
            "windows"
        ],
        "official_site": "https://avidemux.sourceforge.net",
        "official_domain": "avidemux.sourceforge.net",
        "download_page": "https://avidemux.sourceforge.net/download.html",
        "source_repo": "https://github.com/mean00/avidemux2",
        "winget_id": "Avidemux.Avidemux",
        "version": "2.8.1",
        "released": "2022-09-23",
        "license": "GPL-2.0",
        "files": [
            {
                "filename": "Avidemux_2.8.1.VC++.64bits.exe",
                "build": "Windows 64-bit installer",
                "size_mb": 38.1,
                "sha256": "dd962bc788d7d955b04e163e7e1a6620b573adc379bf2ea2a2c25585782b4dca"
            },
            {
                "filename": "Avidemux_2.8.1v2_Monterey_Qt6.dmg",
                "build": "macOS (Monterey, Qt6)",
                "size_mb": 43.4,
                "sha256": "b0b8890114172d531d138f6c1413f0393c0e5a87530168106a12d6b11ae44833"
            },
            {
                "filename": "avidemux_2.8.1.appImage",
                "build": "Linux 64-bit AppImage",
                "size_mb": 42.9,
                "sha256": "4e685fbad0b59d007c5a23ab5fd47948ea5979601e693521f7b842edd4d768a3"
            }
        ],
        "checked": "2026-09-26",
        "details_url": "https://softwares-academy.com/software/avidemux/"
    },
    {
        "id": "bambu-studio",
        "name": "Bambu Studio",
        "publisher": "Bambu Lab",
        "category": "3d-printing",
        "platforms": [
            "linux",
            "mac",
            "windows"
        ],
        "official_site": "https://bambulab.com/en/download/studio",
        "official_domain": "bambulab.com",
        "download_page": "https://github.com/bambulab/BambuStudio/releases/tag/v02.08.02.61",
        "source_repo": "https://github.com/bambulab/BambuStudio",
        "version": "02.08.02.61",
        "released": "2026-08-21",
        "license": "AGPL-3.0",
        "files": [
            {
                "filename": "Bambu_Studio_win-v02.08.02.61-20260820225108.exe",
                "build": "Windows installer",
                "size_mb": 429.02,
                "sha256": "8af94a386689f265d22fd420c6d9bc72d3da872cc2c28d025eef4dd6cd614823"
            },
            {
                "filename": "Bambu_Studio_win-v02.08.02.61-20260820225108.zip",
                "build": "Windows ZIP",
                "size_mb": 473.53,
                "sha256": "3faaa194a90a2e7defa39a6a63f5a654b8cdb762c6a98556cf771fba582229f5"
            },
            {
                "filename": "Bambu_Studio_mac-v02.08.02.61-20260820225108.dmg",
                "build": "macOS DMG",
                "size_mb": 288.33,
                "sha256": "cf648a95858fb630e1353c4987038df60d6caab693f18411fb95fb809f2d6926"
            },
            {